{
  "accepted": false,
  "base_sha": "947f347f219a60775bcf71b226ce778cc8ea21f4",
  "blocking_findings": [],
  "can_skim": [
    {
      "path": "README.md",
      "reason": "no review findings recorded against this file",
      "subject_ids": []
    },
    {
      "path": "docs/adr/0002-graph-engineering-positioning.md",
      "reason": "no review findings recorded against this file",
      "subject_ids": []
    },
    {
      "path": "docs/adr/0012-adr-identifier-inventory.md",
      "reason": "no review findings recorded against this file",
      "subject_ids": []
    },
    {
      "path": "docs/adr/0020-graph-engineering-product-surface.md",
      "reason": "no review findings recorded against this file",
      "subject_ids": []
    },
    {
      "path": "docs/adr/0028-memory-plane-positioning.md",
      "reason": "no review findings recorded against this file",
      "subject_ids": []
    },
    {
      "path": "docs/adr/0029-memory-plane-stable-promotion.md",
      "reason": "no review findings recorded against this file",
      "subject_ids": []
    },
    {
      "path": "docs/design/memory-plane.md",
      "reason": "no review findings recorded against this file",
      "subject_ids": []
    },
    {
      "path": "docs/design/memory-threat-model.md",
      "reason": "no review findings recorded against this file",
      "subject_ids": []
    },
    {
      "path": "docs/guides/mcp-operational-host.md",
      "reason": "no review findings recorded against this file",
      "subject_ids": []
    },
    {
      "path": "docs/guides/memory-plane.md",
      "reason": "no review findings recorded against this file",
      "subject_ids": []
    },
    {
      "path": "docs/pilots/issue-92/README.md",
      "reason": "no review findings recorded against this file",
      "subject_ids": []
    },
    {
      "path": "docs/pilots/issue-92/adversarial-corpus.v0.json",
      "reason": "no review findings recorded against this file",
      "subject_ids": []
    },
    {
      "path": "docs/pilots/issue-92/evaluation-report.v0.json",
      "reason": "no review findings recorded against this file",
      "subject_ids": []
    },
    {
      "path": "docs/pilots/issue-92/memory.claim.v0.json",
      "reason": "no review findings recorded against this file",
      "subject_ids": []
    },
    {
      "path": "docs/pilots/issue-92/memory.policy.v0.json",
      "reason": "no review findings recorded against this file",
      "subject_ids": []
    },
    {
      "path": "docs/pilots/issue-92/memory.query.v0.json",
      "reason": "no review findings recorded against this file",
      "subject_ids": []
    },
    {
      "path": "docs/pilots/issue-92/memory.source_record.v0.json",
      "reason": "no review findings recorded against this file",
      "subject_ids": []
    },
    {
      "path": "docs/pilots/issue-92/source/adr-0002-runtime-boundary.txt",
      "reason": "no review findings recorded against this file",
      "subject_ids": []
    },
    {
      "path": "docs/product-surface.v0.json",
      "reason": "no review findings recorded against this file",
      "subject_ids": []
    },
    {
      "path": "docs/proposals/casegraphen-memory-plane.md",
      "reason": "no review findings recorded against this file",
      "subject_ids": []
    },
    {
      "path": "docs/reviews/graph-engineering-v0-promotion.inventory.json",
      "reason": "no review findings recorded against this file",
      "subject_ids": []
    },
    {
      "path": "schemas/experimental/README.md",
      "reason": "no review findings recorded against this file",
      "subject_ids": []
    },
    {
      "path": "schemas/experimental/contracts.v0.json",
      "reason": "no review findings recorded against this file",
      "subject_ids": []
    },
    {
      "path": "schemas/experimental/control_plane.catalog.v0.example.json",
      "reason": "no review findings recorded against this file",
      "subject_ids": []
    },
    {
      "path": "schemas/experimental/control_plane.catalog.v0.schema.json",
      "reason": "no review findings recorded against this file",
      "subject_ids": []
    },
    {
      "path": "schemas/experimental/control_plane.request.v0.schema.json",
      "reason": "no review findings recorded against this file",
      "subject_ids": []
    },
    {
      "path": "schemas/experimental/memory.claim.v0.example.json",
      "reason": "no review findings recorded against this file",
      "subject_ids": []
    },
    {
      "path": "schemas/experimental/memory.claim.v0.schema.json",
      "reason": "no review findings recorded against this file",
      "subject_ids": []
    },
    {
      "path": "schemas/experimental/memory.index.v0.example.json",
      "reason": "no review findings recorded against this file",
      "subject_ids": []
    },
    {
      "path": "schemas/experimental/memory.index.v0.schema.json",
      "reason": "no review findings recorded against this file",
      "subject_ids": []
    },
    {
      "path": "schemas/experimental/memory.policy.v0.example.json",
      "reason": "no review findings recorded against this file",
      "subject_ids": []
    },
    {
      "path": "schemas/experimental/memory.policy.v0.schema.json",
      "reason": "no review findings recorded against this file",
      "subject_ids": []
    },
    {
      "path": "schemas/experimental/memory.projection.v0.example.json",
      "reason": "no review findings recorded against this file",
      "subject_ids": []
    },
    {
      "path": "schemas/experimental/memory.projection.v0.schema.json",
      "reason": "no review findings recorded against this file",
      "subject_ids": []
    },
    {
      "path": "schemas/experimental/memory.query.v0.example.json",
      "reason": "no review findings recorded against this file",
      "subject_ids": []
    },
    {
      "path": "schemas/experimental/memory.query.v0.schema.json",
      "reason": "no review findings recorded against this file",
      "subject_ids": []
    },
    {
      "path": "schemas/experimental/memory.source_record.v0.schema.json",
      "reason": "no review findings recorded against this file",
      "subject_ids": []
    },
    {
      "path": "schemas/experimental/memory.use_report.v0.example.json",
      "reason": "no review findings recorded against this file",
      "subject_ids": []
    },
    {
      "path": "schemas/experimental/memory.use_report.v0.schema.json",
      "reason": "no review findings recorded against this file",
      "subject_ids": []
    },
    {
      "path": "scripts/install-smoke-test.sh",
      "reason": "no review findings recorded against this file",
      "subject_ids": []
    },
    {
      "path": "scripts/memory-plane-pilot.py",
      "reason": "no review findings recorded against this file",
      "subject_ids": []
    },
    {
      "path": "scripts/product-surface-conformance.py",
      "reason": "no review findings recorded against this file",
      "subject_ids": []
    },
    {
      "path": "scripts/skill-conformance.py",
      "reason": "no review findings recorded against this file",
      "subject_ids": []
    },
    {
      "path": "scripts/static-analysis.sh",
      "reason": "no review findings recorded against this file",
      "subject_ids": []
    },
    {
      "path": "skills/README.md",
      "reason": "no review findings recorded against this file",
      "subject_ids": []
    },
    {
      "path": "skills/casegraphen-memory-audit/SKILL.md",
      "reason": "no review findings recorded against this file",
      "subject_ids": []
    },
    {
      "path": "skills/casegraphen-memory-audit/agents/openai.yaml",
      "reason": "no review findings recorded against this file",
      "subject_ids": []
    },
    {
      "path": "skills/casegraphen-memory-curate/SKILL.md",
      "reason": "no review findings recorded against this file",
      "subject_ids": []
    },
    {
      "path": "skills/casegraphen-memory-curate/agents/openai.yaml",
      "reason": "no review findings recorded against this file",
      "subject_ids": []
    },
    {
      "path": "skills/casegraphen-memory-query/agents/openai.yaml",
      "reason": "no review findings recorded against this file",
      "subject_ids": []
    },
    {
      "path": "skills/casegraphen-operate/capabilities.generated.md",
      "reason": "no review findings recorded against this file",
      "subject_ids": []
    },
    {
      "path": "src/cli.rs",
      "reason": "no review findings recorded against this file",
      "subject_ids": []
    },
    {
      "path": "src/cli_usage.txt",
      "reason": "no review findings recorded against this file",
      "subject_ids": []
    },
    {
      "path": "src/control_plane.rs",
      "reason": "no review findings recorded against this file",
      "subject_ids": []
    },
    {
      "path": "src/lib.rs",
      "reason": "no review findings recorded against this file",
      "subject_ids": []
    },
    {
      "path": "src/memory/index.rs",
      "reason": "no review findings recorded against this file",
      "subject_ids": []
    },
    {
      "path": "src/memory/mod.rs",
      "reason": "no review findings recorded against this file",
      "subject_ids": []
    },
    {
      "path": "src/memory/model.rs",
      "reason": "no review findings recorded against this file",
      "subject_ids": []
    },
    {
      "path": "src/memory/projection.rs",
      "reason": "no review findings recorded against this file",
      "subject_ids": []
    },
    {
      "path": "src/memory/temporal.rs",
      "reason": "no review findings recorded against this file",
      "subject_ids": []
    },
    {
      "path": "src/native_cli.rs",
      "reason": "no review findings recorded against this file",
      "subject_ids": []
    },
    {
      "path": "src/native_cli/ops.rs",
      "reason": "no review findings recorded against this file",
      "subject_ids": []
    },
    {
      "path": "src/native_cli/ops/memory.rs",